{
  "plugin_slug": "hetzner-seo-ops",
  "plugin_version": "0.1.0-real-staging1",
  "release_channel": "pilot",
  "package_basename": "site-optimizer-bridge-0.1.0-real-staging1-wp-electri-c-ity-studios-24-7-com",
  "package_filename": "site-optimizer-bridge-0.1.0-real-staging1-wp-electri-c-ity-studios-24-7-com.zip",
  "package_sha256": "1086d2ca447b53b44274f18c73773bb830b9a6b2cc6ae78edb456ad98a0adee7",
  "file_count": 14,
  "build_mode": "local_preview_only",
  "built_at": "2026-04-19T21:00:00Z"
}
